citation_key,name,year,venue,task_type,hops,evidence_source,primary_estimand,diagnostics,source_url,data_url,status,caveat
yang2018hotpotqa,HotpotQA,2018,EMNLP,multi-hop QA,2,text,joint,answer;supporting_facts;multi-hop reasoning,https://aclanthology.org/D18-1259/,https://hotpotqa.github.io/,reviewed,Supporting-fact annotations are a proxy rather than a complete latent chain.
ho2020twowiki,2WikiMultiHopQA,2020,COLING,multi-hop QA,2,hybrid,joint,answer;evidence;reasoning types,https://aclanthology.org/2020.coling-main.580/,https://github.com/Alab-NII/2wikimultihop,reviewed,Construction and evidence provenance should be considered in cross-dataset comparisons.
jiang2020hover,HoVer,2020,Findings EMNLP,many-hop claim verification,2-4,text,joint,label;evidence retrieval;HoVer score,https://aclanthology.org/2020.findings-emnlp.309/,https://hover-nlp.github.io/,reviewed,The claim-verification setting is not answer extraction and includes multi-sentence claims at higher hop counts.
petroni2021kilt,KILT: a Benchmark for Knowledge Intensive Language Tasks,2021,NAACL,knowledge-intensive tasks,varied,text,observability,provenance;answer;retrieval,https://aclanthology.org/2021.naacl-main.200/,https://github.com/facebookresearch/KILT,reviewed,Not exclusively a multi-hop benchmark.
trivedi2022musique,MuSiQue: Multihop Questions via Single-hop Question Composition,2022,TACL,multi-hop QA,2-4,text,joint,answer;supporting paragraphs;compositionality,https://aclanthology.org/2022.tacl-1.31/,https://github.com/stonybrooknlp/musique,reviewed,Reported metrics depend on the retrieval setting and distractor construction.
khot2020qasc,QASC,2020,AAAI,multi-hop multiple-choice QA,2,text,joint,answer;supporting facts;fact composition,https://ojs.aaai.org/index.php/AAAI/article/view/6319,https://allenai.org/data/qasc,reviewed,Two annotated facts do not eliminate the need for open-corpus retrieval or commonsense composition.
